{
  "$schema": "../schemas/citation_verification_rules.schema.json",
  "schema_version": "citation_verification_rules.v1",
  "report_path": "logs/quality-gates/citation-verification-report.json",
  "gate_id": "doi_and_metadata_verified",
  "required_reference_fields": [
    "author",
    "year",
    "title",
    "source",
    "verified",
    "verification_source",
    "verification_basis"
  ],
  "optional_reference_fields": [
    "doi",
    "pdf_fulltext_evidence",
    "doi_waiver_evidence",
    "zotero_key"
  ],
  "pass_requires": [
    "report_status_pass",
    "all_references_verified",
    "all_formal_references_have_doi_or_approved_doi_waiver",
    "all_references_have_author_year_title_source"
  ],
  "doi_waiver_policy": {
    "enabled": true,
    "applies_to": [
      "user_provided_source",
      "complete_pdf_fulltext",
      "public_academic_index_record"
    ],
    "public_academic_indexes": [
      "Google Scholar",
      "OpenAlex",
      "CNKI",
      "Crossref",
      "Semantic Scholar",
      "publisher_or_journal_page",
      "institutional_repository"
    ],
    "required_evidence_fields": [
      "waiver_type",
      "evidence_source",
      "locator",
      "title_match",
      "author_or_source_match",
      "year_or_source_match",
      "checked_at"
    ],
    "policy": "DOI is not a mandatory field when the reference is user-provided, has a verified complete paper PDF fulltext, or is verifiably discoverable in a public academic index such as Google Scholar, OpenAlex, CNKI, Crossref, Semantic Scholar, a publisher or journal page, or an institutional repository. If a DOI is present in the evidence, verify it; never fabricate a DOI."
  },
  "pdf_fulltext_waiver": {
    "enabled": true,
    "applies_to": [
      "user_uploaded_pdf",
      "user_local_pdf",
      "authorized_downloaded_pdf",
      "codex_downloaded_pdf"
    ],
    "required_evidence_fields": [
      "file_path",
      "source_type",
      "title_match",
      "author_or_source_match",
      "page_count",
      "readable"
    ],
    "policy": "A verified complete paper PDF fulltext is one accepted DOI-waiver basis. Record file source, first-page or metadata match, title, author or source match, year or source match, page count, and readability. If a DOI is present in the PDF or companion metadata, verify it; never fabricate a DOI."
  },
  "formal_reference_policy": "Formal academic references must be verified before delivery. DOI is a strong verification basis, but it is not the only pass condition. A reference may pass without DOI when at least one approved DOI-waiver basis is recorded: user-provided source evidence, verified complete paper PDF fulltext, or a public academic index record from Google Scholar, OpenAlex, CNKI, Crossref, Semantic Scholar, a publisher or journal page, or an institutional repository. Every passing reference still needs author, year, title, source, verification source, verification basis, and auditable evidence. If a DOI is present in the evidence, verify it; never fabricate a DOI."
}
